{
  "id": "gemini-cli",
  "version": 1,
  "status": "stable",
  "target_family": "agent-skills",
  "official_documentation": "https://geminicli.com/docs/cli/using-agent-skills/",
  "targets": {
    "user": "~/.agents/skills",
    "project": ".agents/skills"
  },
  "native_alternatives": {
    "user": "~/.gemini/skills",
    "project": ".gemini/skills"
  },
  "skill_file": "SKILL.md",
  "portable_frontmatter_allowlist": ["name", "description", "license", "compatibility", "metadata"],
  "strip_paths": ["agents"],
  "copy_mode": "directory",
  "install_executes_skill_code": false
}
